{
  "$schema": "../../schemas/flutterflow-client-inventory.schema.json",
  "schemaVersion": 1,
  "application": "vocostar",
  "project": { "id": "vocal-transform-z2j7dp", "name": "VocoStar" },
  "sourceSnapshot": "config/flutterflow-sources/vocostar.json",
  "migrationPlan": "config/flutterflow-migrations/vocostar.json",
  "surfaceManifest": "config/flutterflow-custom-code.json",
  "receipt": {
    "reviewedExportTimestamp": "2026-08-09T22:47:59.485414Z",
    "currentStatus": "reviewed-export-receipt-replaced",
    "reason": "A later successful dry-run replaced .flutterflow/last_run.json; the reviewed export remains the AS-IS inventory but cannot currently claim snapshotVerified=true."
  },
  "inventory": {
    "pages": [
      {
        "names": ["index"],
        "classification": "common",
        "authority": "identity",
        "replacementSymbols": ["OpenGrowBootstrap"],
        "phase": "identity-runtime",
        "gate": "identity-secure-session-wired"
      },
      {
        "names": [
          "onboard00",
          "onboard01",
          "onboard02",
          "onboard03",
          "onboard04",
          "onboard05"
        ],
        "classification": "remove",
        "authority": "onboardings",
        "replacementSymbols": ["OpenGrowOnboarding"],
        "phase": "onboardings-marketing",
        "gate": "legacy-onboarding-pages-removed"
      },
      {
        "names": [
          "user_clone",
          "user_vocals",
          "user_library",
          "user_record_audio",
          "user_record_text",
          "user_record_video",
          "user_upload",
          "user_player_media"
        ],
        "classification": "vocostar",
        "authority": "custom-jobs",
        "replacementSymbols": [
          "opengrowApplicationCreateCustomJobJson",
          "opengrowApplicationListCustomJobsJson"
        ],
        "phase": "custom-jobs",
        "gate": "custom-jobs-authority-wired"
      },
      {
        "names": ["user_link_account", "user_sign_account", "settings_user"],
        "classification": "configurable",
        "authority": "identity",
        "replacementSymbols": [
          "opengrowApplicationSignInProviderJson",
          "opengrowApplicationLinkProviderJson"
        ],
        "phase": "identity-runtime",
        "gate": "identity-authority-wired"
      },
      {
        "names": ["settings_support", "settings_ticket"],
        "classification": "common",
        "authority": "support",
        "replacementSymbols": ["opengrowSupportInitializeAuthenticated"],
        "phase": "support",
        "gate": "support-authority-wired"
      },
      {
        "names": ["settings_language", "privacy_policy", "terms_of_use"],
        "classification": "configurable",
        "authority": "local-ui",
        "replacementSymbols": [],
        "phase": null,
        "gate": null
      }
    ],
    "components": [
      {
        "names": [
          "ButtonLanguage",
          "ButtonSettings",
          "ButtonSettingsLarge",
          "Header",
          "HeaderMedia",
          "HeaderOnBoarding",
          "MenuBottom"
        ],
        "classification": "configurable",
        "authority": "local-ui",
        "replacementSymbols": [],
        "phase": null,
        "gate": null
      },
      {
        "names": [
          "CardCloneList",
          "CardHotReplay",
          "CardMediaList",
          "CardVocalList",
          "CardVocalMedia",
          "InfoLibrary"
        ],
        "classification": "vocostar",
        "authority": "custom-jobs",
        "replacementSymbols": [],
        "phase": "custom-jobs",
        "gate": "custom-jobs-authority-wired"
      },
      {
        "names": ["CardPaywall", "CardToken", "FeatureItem", "Paycreditv1"],
        "classification": "remove",
        "authority": "billing",
        "replacementSymbols": ["OpenGrowPaywall"],
        "phase": "billing",
        "gate": "billing-authority-wired"
      }
    ],
    "appState": [
      {
        "names": ["appBoard", "appQuestions", "appReponse"],
        "persisted": true,
        "classification": "remove",
        "authority": "onboardings",
        "replacementSymbols": ["OpenGrowOnboarding"],
        "phase": "onboardings-marketing",
        "gate": "legacy-onboarding-loader-removed"
      },
      {
        "names": ["appPaywall"],
        "persisted": true,
        "classification": "remove",
        "authority": "billing",
        "replacementSymbols": ["OpenGrowPaywall"],
        "phase": "billing",
        "gate": "billing-authority-wired"
      },
      {
        "names": ["appMenu", "lightMode"],
        "persisted": true,
        "classification": "configurable",
        "authority": "local-ui",
        "replacementSymbols": [],
        "phase": null,
        "gate": null
      },
      {
        "names": [
          "appVocals",
          "appUserMedias",
          "appUserVocals",
          "userCategories",
          "userHasMedia",
          "userHasVocals",
          "userVocals"
        ],
        "persisted": true,
        "classification": "vocostar",
        "authority": "custom-jobs",
        "replacementSymbols": ["opengrowApplicationListCustomJobsJson"],
        "phase": "custom-jobs",
        "gate": "custom-jobs-authority-wired"
      },
      {
        "names": [
          "appRefresh",
          "appWall",
          "userBoardingProgress",
          "uploadProgress"
        ],
        "persisted": false,
        "classification": "configurable",
        "authority": "local-ui",
        "replacementSymbols": [],
        "phase": null,
        "gate": null
      },
      {
        "names": ["userBoardingView", "userPaywallView"],
        "persisted": true,
        "classification": "configurable",
        "authority": "app",
        "replacementSymbols": [],
        "phase": "onboardings-marketing",
        "gate": "onboardings-authority-wired"
      },
      {
        "names": ["authAccessToken", "authExpiresIn", "authRefreshToken"],
        "persisted": true,
        "classification": "remove",
        "authority": "identity",
        "replacementSymbols": ["opengrowApplicationRestoreSessionJson"],
        "phase": "identity-runtime",
        "gate": "persisted-access-token-removed"
      },
      {
        "names": ["authUserData", "authUserId", "userDeviceID"],
        "persisted": true,
        "classification": "common",
        "authority": "identity",
        "replacementSymbols": ["opengrowApplicationProfileJson"],
        "phase": "identity-runtime",
        "gate": "identity-authority-wired"
      },
      {
        "names": ["opengrowPurchasesReady"],
        "persisted": false,
        "classification": "common",
        "authority": "billing",
        "replacementSymbols": ["opengrowGetCustomerInfoJson"],
        "phase": "billing",
        "gate": "billing-authority-wired"
      },
      {
        "names": ["userCredits", "userPremium"],
        "persisted": true,
        "classification": "remove",
        "authority": "billing",
        "replacementSymbols": [
          "opengrowGetVirtualCurrenciesJson",
          "opengrowGetCustomerInfoJson"
        ],
        "phase": "billing",
        "gate": "client-entitlement-activation-removed"
      },
      {
        "names": [
          "supportContactId",
          "supportPubsubToken",
          "supportUnreadCount"
        ],
        "persisted": true,
        "classification": "remove",
        "authority": "support",
        "replacementSymbols": ["opengrowSupportInitializeAuthenticated"],
        "phase": "support",
        "gate": "legacy-support-init-removed"
      },
      {
        "names": ["supportConversationId", "supportMessages"],
        "persisted": false,
        "classification": "remove",
        "authority": "support",
        "replacementSymbols": ["opengrowSupportMessagesJson"],
        "phase": "support",
        "gate": "legacy-support-widget-removed"
      },
      {
        "names": ["userFcmToken"],
        "persisted": true,
        "classification": "remove",
        "authority": "notifications",
        "replacementSymbols": ["opengrowSetPushToken"],
        "phase": "files-notifications",
        "gate": "persisted-notification-token-removed"
      }
    ],
    "structs": [
      {
        "names": ["appBoard", "appQuestion"],
        "classification": "remove",
        "authority": "onboardings",
        "replacementSymbols": ["OpenGrowOnboarding"],
        "phase": "onboardings-marketing",
        "gate": "legacy-onboarding-loader-removed"
      },
      {
        "names": ["appPaywall"],
        "classification": "remove",
        "authority": "billing",
        "replacementSymbols": ["OpenGrowPaywall"],
        "phase": "billing",
        "gate": "billing-authority-wired"
      },
      {
        "names": ["appSupportMessages"],
        "classification": "remove",
        "authority": "support",
        "replacementSymbols": ["opengrowSupportMessagesJson"],
        "phase": "support",
        "gate": "legacy-support-widget-removed"
      },
      {
        "names": ["user"],
        "classification": "common",
        "authority": "identity",
        "replacementSymbols": ["opengrowApplicationProfileJson"],
        "phase": "identity-runtime",
        "gate": "identity-authority-wired"
      },
      {
        "names": ["appCategory"],
        "classification": "configurable",
        "authority": "app",
        "replacementSymbols": [],
        "phase": "onboardings-marketing",
        "gate": "onboardings-authority-wired"
      },
      {
        "names": ["appVocals", "userMedias", "userVocals"],
        "classification": "vocostar",
        "authority": "custom-jobs",
        "replacementSymbols": [],
        "phase": "custom-jobs",
        "gate": "custom-jobs-authority-wired"
      }
    ],
    "apiCalls": [
      {
        "names": ["auth Logout"],
        "classification": "remove",
        "authority": "identity",